nct_id,title,status,start_date,completion_date,primary_completion_date,phase,enrollment,study_type,allocation,intervention_model,primary_purpose,masking,conditions,intervention_types,intervention_names,sponsor,sponsor_type,has_results,num_outcome_measures,num_primary_outcomes,num_secondary_outcomes,num_p_values_in_primary,enrollment_missing
NCT06435676,A Study of Single and Multiple Doses HRS9531 Tablets in Healthy Subjects,COMPLETED,2024-06-04,2024-10-08,2024-10-08,PHASE1,72.0,INTERVENTIONAL,RANDOMIZED,PARALLEL,TREATMENT,TRIPLE,Overweight or Obesity; Type 2 Diabetes,"DRUG, DRUG, DRUG, DRUG","HRS9531, Placebo, HRS9531, Placebo","Fujian Shengdi Pharmaceutical Co., Ltd.",INDUSTRY,False,0,0,0,0,0
NCT00882726,"A Study of the Safety, Pharmacokinetics, and Pharmacodynamics of CNTO 3649 in Healthy Adults and Patients With Type 2 Diabetes Mellitus",COMPLETED,2009-02,2010-04,2010-04,PHASE1,133.0,INTERVENTIONAL,RANDOMIZED,SINGLE_GROUP,TREATMENT,QUADRUPLE,"Diabetes Mellitus, Type 2","DRUG, DRUG, DRUG, DRUG","CNTO 3649 IV (Healthy participants), CNTO 3649 SC (Healthy participants), CNTO 3649 SC (Diabetic patients), Placebo","Centocor, Inc.",INDUSTRY,False,0,0,0,0,0
NCT01432938,A Study of the Effect of Dulaglutide on the Action of Warfarin in Healthy Participants,COMPLETED,2011-09,2011-12,2011-12,PHASE1,28.0,INTERVENTIONAL,RANDOMIZED,CROSSOVER,TREATMENT,NONE,"Diabetes Mellitus, Type 2","BIOLOGICAL, DRUG","dulaglutide, Warfarin",Eli Lilly and Company,INDUSTRY,True,5,3,2,0,0
NCT04524832,"Research Study Comparing New Tablets of Semaglutide in New Doses, in Healthy People",COMPLETED,2020-09-29,2022-02-25,2022-02-25,PHASE1,290.0,INTERVENTIONAL,RANDOMIZED,PARALLEL,TREATMENT,NONE,"Diabetes Mellitus, Type 2",DRUG,Oral semaglutide,Novo Nordisk A/S,INDUSTRY,False,0,0,0,0,0
NCT00618995,"A Study to Evaluate the Effects of ER Niacin/Laropiprant, Laropiprant, ER Niacin, and Placebo on Urinary Prostanoid Metabolites (0524A-079)(COMPLETED)",COMPLETED,2007-08,2007-12,2007-12,PHASE1,26.0,INTERVENTIONAL,RANDOMIZED,CROSSOVER,TREATMENT,DOUBLE,Type 2 Diabetes Mellitus,"DRUG, DRUG, DRUG, DRUG","Comparator: ER niacin (+) laropiprant, Comparator: ER niacin, Comparator: laropiprant, Comparator: placebo",Merck Sharp & Dohme LLC,INDUSTRY,True,2,1,1,0,0
NCT02722239,"An Open-label, Randomized, Crossover Study of Comparative Pharmacokinetics and Bioequivalence of Dapagliflozin + Metformin, 10 mg + 1000 mg Versus the Combined Use of Forxiga™, 10 mg and Two Glucophage® Long, ER Tablets, 500 mg Co-administered to Healthy Volunteers Under Standard Fed Conditions",COMPLETED,2016-03-30,2016-05-05,2016-05-05,PHASE1,40.0,INTERVENTIONAL,RANDOMIZED,CROSSOVER,TREATMENT,NONE,"Diabetes Mellitus, Type 2","DRUG, DRUG, DRUG","Xigduo XR, Metformin ER (Glucophage® long), Dapagliflozin (Forxiga)",AstraZeneca,INDUSTRY,True,5,5,0,0,0
NCT02375139,A Clinical Trial to Investigate Safety/Tolerability and Pharmacokinetics of DA-1229_01(Evogliptin/Metformin XR 2.5/500 mg x 2 Tablets) Compared to Co-administration of Evogliptin 5 mg and Metformin XR 1000 mg in Healthy Male Volunteers,COMPLETED,2015-04,2015-06,2015-06,PHASE1,36.0,INTERVENTIONAL,RANDOMIZED,CROSSOVER,TREATMENT,NONE,Type 2 Diabetes Mellitus,"DRUG, DRUG","DA-1229_01, E+M","Dong-A ST Co., Ltd.",INDUSTRY,False,0,0,0,0,0
NCT03115099,A Study of LY3325656 in Healthy Participants and Participants With Type 2 Diabetes,COMPLETED,2017-05-31,2018-04-05,2018-04-05,PHASE1,80.0,INTERVENTIONAL,RANDOMIZED,CROSSOVER,BASIC_SCIENCE,DOUBLE,"Diabetes Mellitus, Type 2","DRUG, DRUG, DRUG, DRUG","LY3325656, Placebo, Liraglutide, Sitagliptin",Eli Lilly and Company,INDUSTRY,False,0,0,0,0,0
NCT00865033,"A Relative Bioavailability Study of Metformin HCL Tablets, 1000 mg Under Fasting Conditions",COMPLETED,2005-11,2005-11,2005-11,PHASE1,32.0,INTERVENTIONAL,RANDOMIZED,CROSSOVER,TREATMENT,NONE,Type 2 Diabetes,"DRUG, DRUG","Metformin HCL Tablets, 1000 mg Sandoz, Glucophage 1000 mg",Sandoz,INDUSTRY,False,0,0,0,0,0
NCT01436201,A Study of the Effect of Dulaglutide on How Body Handles Digoxin in Healthy Participants,COMPLETED,2011-09,2011-11,2011-11,PHASE1,24.0,INTERVENTIONAL,UNKNOWN,SINGLE_GROUP,TREATMENT,NONE,"Diabetes Mellitus, Type 2","DRUG, BIOLOGICAL","Digoxin, Dulaglutide",Eli Lilly and Company,INDUSTRY,True,3,3,0,0,0
NCT01396187,Safety and Tolerability of Ascending Intravenous Doses of PF-05231023 In Adult Subjects With Type 2 Diabetes,COMPLETED,2011-07,2012-05,2012-05,PHASE1,50.0,INTERVENTIONAL,RANDOMIZED,PARALLEL,TREATMENT,TRIPLE,"Diabetes Mellitus, Type 2","DRUG, DRUG, DRUG, DRUG, OTHER","PF-05231023, PF-05231023, PF-05231023, PF-05231023, Placebo",Pfizer,INDUSTRY,True,20,6,14,0,0
NCT01677611,Effects of Resveratrol in Patients With Type 2 Diabetes,COMPLETED,2008-12,2012-03,2010-09,PHASE1,10.0,INTERVENTIONAL,RANDOMIZED,PARALLEL,BASIC_SCIENCE,QUADRUPLE,Type 2 Diabetes,"DRUG, DRUG","Trans-resveratrol extract from Polygonum Cuspidatum, Placebo",Khoo Teck Puat Hospital,OTHER,False,0,0,0,0,0
NCT01515592,Safety and Tolerability of Liraglutide in Healthy Japanese Male Volunteers,COMPLETED,2006-01,2006-04,2006-04,PHASE1,24.0,INTERVENTIONAL,RANDOMIZED,CROSSOVER,TREATMENT,DOUBLE,"Diabetes, Diabetes Mellitus, Type 2","DRUG, DRUG, DRUG, DRUG","liraglutide, liraglutide, liraglutide, placebo",Novo Nordisk A/S,INDUSTRY,False,0,0,0,0,0
NCT01478399,"Pharmacokinetic, Safety/Tolerability Study of a Single SC Dose of PB1023 Injection in Subjects With Normal and Impaired Renal Function",COMPLETED,2011-12,2012-10,2012-10,PHASE1,16.0,INTERVENTIONAL,NON_RANDOMIZED,PARALLEL,TREATMENT,NONE,"Diabetes Mellitus, Type 2",DRUG,PB1023 Injection,PhaseBio Pharmaceuticals Inc.,INDUSTRY,False,0,0,0,0,0
NCT02935712,"Assessment of the Safety, Tolerability and Pharmacodynamics After Administration of One Dose of AZD8601 to Male Patients With Type II Diabetes Mellitus (T2DM)",COMPLETED,2016-12-16,2018-01-08,2017-08-04,PHASE1,44.0,INTERVENTIONAL,RANDOMIZED,PARALLEL,TREATMENT,SINGLE,Male Subjects With Type II Diabetes (T2DM),"DRUG, DRUG, DRUG","AZD8601+Placebo (SAD), AZD8601+Placebo, Placebo+Placebo",AstraZeneca,INDUSTRY,False,0,0,0,0,0
NCT01527630,Bioequivalence of Two Formulations of Biphasic Insulin Aspart 50 in Healthy Japanese Subjects,COMPLETED,2002-11-16,2003-01-08,2003-01-08,PHASE1,30.0,INTERVENTIONAL,RANDOMIZED,CROSSOVER,TREATMENT,DOUBLE,"Diabetes, Diabetes Mellitus, Type 2",DRUG,biphasic insulin aspart 50,Novo Nordisk A/S,INDUSTRY,False,0,0,0,0,0
NCT01188863,Study of Two Oral Formulations of LX4211 in Patients With Type 2 Diabetes Mellitus,COMPLETED,2010-09,2010-10,2010-10,PHASE1,15.0,INTERVENTIONAL,RANDOMIZED,CROSSOVER,TREATMENT,NONE,Type 2 Diabetes Mellitus,"DRUG, DRUG, DRUG","300 mg LX4211 (150 mg tablets), 300 mg LX4211 (50 mg tablets), 300 mg LX4211 (liquid)",Lexicon Pharmaceuticals,INDUSTRY,False,0,0,0,0,0
NCT03033433,DCB-DM101 in Healthy Volunteers and for Type 2 Diabetes Mellitus Patients,COMPLETED,2016-10,2018-08,2017-12,PHASE1,28.0,INTERVENTIONAL,UNKNOWN,SINGLE_GROUP,TREATMENT,NONE,Type2 Diabetes,DRUG,DCB-DM101,"VitNovo, Inc.",INDUSTRY,False,0,0,0,0,0
NCT01838083,Euglycemic Clamp Study Comparing Two New Insulin Glargine Formulations in Subjects With Type 1 Diabetes Mellitus,COMPLETED,2013-04,2013-08,2013-08,PHASE1,50.0,INTERVENTIONAL,RANDOMIZED,CROSSOVER,TREATMENT,DOUBLE,Type1 Diabetes,DRUG,Insulin glargine new formulation HOE901,Sanofi,INDUSTRY,False,0,0,0,0,0
NCT00609154,Effect of GLP-1 on Insulin Biosynthesis and Turnover Rates,TERMINATED,2010-08-12,2014-05-13,2014-05-13,PHASE1,20.0,INTERVENTIONAL,RANDOMIZED,PARALLEL,BASIC_SCIENCE,NONE,Type 2 Diabetes,"DRUG, DIETARY_SUPPLEMENT","glucagon like peptide-1, glucose control",Albert Einstein College of Medicine,OTHER,True,1,1,0,0,0
NCT02845219,A Trial Investigating the Influence of Oral Semaglutide on Pharmacokinetics of Ethinylestradiol and Levonorgestrel in an Oral Contraceptive Combination Drug in Healthy Postmenopausal Females,COMPLETED,2016-07,2016-12,2016-12,PHASE1,25.0,INTERVENTIONAL,UNKNOWN,SINGLE_GROUP,TREATMENT,NONE,"Diabetes, Diabetes Mellitus, Type 2","DRUG, DRUG, DRUG","semaglutide, SNAC, Microgynon®",Novo Nordisk A/S,INDUSTRY,False,0,0,0,0,0
NCT01223339,"Evaluation of Pharmacokinetics, Safety, And Tolerability Of Ertugliflozin (PF-04971729, MK-8835) In Japanese And Western Healthy Participants (MK-8835-041)",COMPLETED,2010-10,2011-02,2011-02,PHASE1,24.0,INTERVENTIONAL,RANDOMIZED,PARALLEL,TREATMENT,DOUBLE,"Diabetes Mellitus, Type 2","DRUG, DRUG, DRUG, DRUG","Ertugliflozin, Placebo, Ertugliflozin, Placebo",Merck Sharp & Dohme LLC,INDUSTRY,False,0,0,0,0,0
NCT00537719,Scintigraphy Study to Assess Gastric Emptying in Healthy Subjects Given GSK716155 or Placebo.,COMPLETED,2007-12-07,2008-04-04,2008-04-04,PHASE1,34.0,INTERVENTIONAL,RANDOMIZED,PARALLEL,TREATMENT,SINGLE,"Diabetes Mellitus, Type 2","DRUG, DRUG","GSK716155, Placebo",GlaxoSmithKline,INDUSTRY,False,0,0,0,0,0
NCT01582308,"A Study Comparing the Pharmacokinetic and Pharmacodynamic Profiles for Sitagliptin, Saxagliptin and Vildagliptin in Participants With Type 2 Diabetes Mellitus (T2DM) (MK-0431-142)",COMPLETED,2012-06-21,2012-12-14,2012-12-04,PHASE1,22.0,INTERVENTIONAL,RANDOMIZED,CROSSOVER,TREATMENT,NONE,Type 2 Diabetes Mellitus,"DRUG, DRUG, DRUG, DRUG, DRUG","Sitagliptin 100 mg, Saxagliptin 5 mg, Vildagliptin 50 mg, Vildagliptin 50 mg BID, Placebo",Merck Sharp & Dohme LLC,INDUSTRY,True,5,1,4,10,0
NCT05409924,First-in-human Single and Multiple Dose Trial of ATR-258,COMPLETED,2022-04-11,2023-10-04,2023-10-04,PHASE1,71.0,INTERVENTIONAL,RANDOMIZED,SEQUENTIAL,TREATMENT,TRIPLE,Type 2 Diabetes Mellitus,"DRUG, DRUG, DRUG","ATR-258, ATR-258, ATR-258",Atrogi AB,INDUSTRY,False,0,0,0,0,0
NCT01821079,A Healthy Volunteer Study To Assess Relative Bioavailability Of Powder-In-Capsule And A Tablet Formulation And The Effect Of Food On The Pharmacokinetics Of The Tablet Formulation,COMPLETED,2013-03,2013-04,2013-04,PHASE1,12.0,INTERVENTIONAL,RANDOMIZED,CROSSOVER,BASIC_SCIENCE,NONE,Healthy,"DRUG, DRUG, DRUG, DRUG","PF-05175157, PF-05175157, PF-05175157, PF-05175157",Pfizer,INDUSTRY,False,0,0,0,0,0
NCT02500979,Effect of a Fixed Pramlintide: Insulin Dose Ratio on Postprandial Glucose in Type 1 Diabetes Mellitus,COMPLETED,2015-08-17,2016-08-05,2016-08-05,PHASE1,34.0,INTERVENTIONAL,RANDOMIZED,CROSSOVER,TREATMENT,SINGLE,Type 1 Diabetes Mellitus,"DRUG, DRUG, DRUG, DRUG","Pramlintide acetate, Placebo, Lispro insulin U-100, Regular insulin U-100",AstraZeneca,INDUSTRY,True,15,1,14,1,0
NCT04235959,A Study of Tirzepatide in Chinese Participants With Type 2 Diabetes Mellitus,COMPLETED,2020-10-21,2021-08-17,2021-08-17,PHASE1,24.0,INTERVENTIONAL,RANDOMIZED,PARALLEL,BASIC_SCIENCE,DOUBLE,"Diabetes Mellitus, Type 2","DRUG, DRUG","Tirzepatide, Placebo",Eli Lilly and Company,INDUSTRY,True,5,1,4,0,0
NCT01121276,A Trial Investigating NN1218 in Subjects With Type 1 and Type 2 Diabetes,COMPLETED,2010-04,2010-09,2010-09,PHASE1,82.0,INTERVENTIONAL,RANDOMIZED,CROSSOVER,TREATMENT,DOUBLE,"Diabetes, Diabetes Mellitus, Type 1, Diabetes Mellitus, Type 2","DRUG, DRUG, DRUG, DRUG, DRUG","Faster-acting insulin aspart, insulin aspart, Faster-acting insulin aspart, Faster-acting insulin aspart, Faster-acting insulin aspart",Novo Nordisk A/S,INDUSTRY,False,0,0,0,0,0
NCT06289920,"A Study to Compare the Pharmacokinetics and the Safety Between a Fixed-dose Combination Administration of ""BR3005"" and Co-administration of ""BR3005-1"" and ""BR3005-2"" Under Fasting Conditions in Healthy Adult Volunteers",COMPLETED,2024-03-02,2024-03-28,2024-03-28,PHASE1,47.0,INTERVENTIONAL,RANDOMIZED,CROSSOVER,TREATMENT,NONE,Type 2 Diabetes Mellitus,"DRUG, DRUG, DRUG","BR3005, BR3005-1, BR3005-2","Boryung Pharmaceutical Co., Ltd",INDUSTRY,False,0,0,0,0,0
NCT01131091,"A Multicenter, Open Label, Single Dose Study to Evaluate the Effect of Renal Insufficiency on the Pharmacokinetics of SK 0403",COMPLETED,2010-05,2010-11,2010-11,PHASE1,30.0,INTERVENTIONAL,NON_RANDOMIZED,PARALLEL,TREATMENT,NONE,Type 2 Diabetes Mellitus,DRUG,SK-0403,"Kowa Research Institute, Inc.",INDUSTRY,False,0,0,0,0,0
NCT05761301,A Phase 1/2 Study to Evaluate ALN-KHK in Overweight to Obese Healthy Volunteers and Obese Patients With T2DM,TERMINATED,2023-03-10,2025-04-03,2025-04-03,PHASE1,49.0,INTERVENTIONAL,RANDOMIZED,SEQUENTIAL,TREATMENT,TRIPLE,Type 2 Diabetes Mellitus (T2DM),"DRUG, DRUG","ALN-KHK, Placebo",Alnylam Pharmaceuticals,INDUSTRY,False,0,0,0,0,0
NCT01154881,A Trial Evaluating the Blood Glucose-lowering Effect of NN1250 in Subjects With Type 2 Diabetes,COMPLETED,2010-06,2010-11,2010-11,PHASE1,49.0,INTERVENTIONAL,RANDOMIZED,CROSSOVER,TREATMENT,DOUBLE,"Diabetes, Diabetes Mellitus, Type 2",DRUG,insulin degludec,Novo Nordisk A/S,INDUSTRY,False,0,0,0,0,0
NCT01398267,A Pharmacodynamic/Pharmacokinetic Study of Aleglitazar in Patients With Type 2 Diabetes Mellitus on Treatment With Lisinopril,COMPLETED,2011-08,2012-10,2012-10,PHASE1,55.0,INTERVENTIONAL,RANDOMIZED,PARALLEL,TREATMENT,DOUBLE,Diabetes Mellitus Type 2,"DRUG, DRUG, DRUG","aleglitazar, lisinopril, placebo",Hoffmann-La Roche,INDUSTRY,False,0,0,0,0,0
NCT00961909,A Study of RO5095932 in Patients With Type 2 Diabetes Mellitus,COMPLETED,2009-06,2010-10,2010-10,PHASE1,122.0,INTERVENTIONAL,UNKNOWN,PARALLEL,TREATMENT,DOUBLE,Diabetes Mellitus Type 2,"DRUG, DRUG, DRUG, DRUG","RO5095932, RO5095932, metformin, placebo",Hoffmann-La Roche,INDUSTRY,False,0,0,0,0,0
NCT02346175,"Pharmacodynamics, Pharmacokinetics, Safety and Tolerability of SHR3824 in Type 2 Diabetes Mellitus Patients",COMPLETED,2014-06,2014-12,2014-09,PHASE1,30.0,INTERVENTIONAL,RANDOMIZED,PARALLEL,TREATMENT,QUADRUPLE,Type 2 Diabetes Mellitus,"DRUG, DRUG","SHR3824, Placebo","Jiangsu HengRui Medicine Co., Ltd.",INDUSTRY,False,0,0,0,0,0
NCT06204107,A Clinical Trial to Evaluate the Food Effect on Pharmacokinetic Profiles and Safety of CKD-379,COMPLETED,2023-11-21,2023-12-06,2023-12-06,PHASE1,28.0,INTERVENTIONAL,RANDOMIZED,CROSSOVER,TREATMENT,NONE,Type 2 Diabetes Mellitus,"DRUG, DRUG","CKD-379(Empagliflozin+sitagliptin+metformin) Test drug, CKD-379(Empagliflozin+sitagliptin+metformin) Reference drug",Chong Kun Dang Pharmaceutical,INDUSTRY,False,0,0,0,0,0
NCT00813228,Assessment of the Effects of a DPP-4 Inhibitor (Sitagliptin) Januvia on Immune Function in Healthy Individuals,COMPLETED,2009-01-06,2019-11-26,2019-11-26,PHASE1,76.0,INTERVENTIONAL,RANDOMIZED,PARALLEL,TREATMENT,NONE,"Diabetes Mellitus Type 1, Diabetes Mellitus Type 2",DRUG,Sitagliptin (Januvia),National Institute of Diabetes and Digestive and Kidney Diseases (NIDDK),NIH,False,0,0,0,0,0
NCT06423872,A SAD Study of ZT002 Injection in Healthy Participants,COMPLETED,2023-06-19,2023-12-08,2023-10-20,PHASE1,28.0,INTERVENTIONAL,RANDOMIZED,PARALLEL,TREATMENT,QUADRUPLE,Type 2 Diabetes Mellitus,"DRUG, OTHER","ZT002, Placebo","Beijing QL Biopharmaceutical Co.,Ltd",INDUSTRY,False,0,0,0,0,0
NCT00937872,A Clinical Study to Evaluate the Pharmacokinetics and the Absolute Bioavailability of SRT2104 Given as a 250mg Oral Suspension and Intravenous Microdose of 100 µg Carbon-14 Radio-labeled SRT2104 in Healthy Male Subjects,COMPLETED,2008-11-22,2008-12-22,2008-12-22,PHASE1,9.0,INTERVENTIONAL,UNKNOWN,CROSSOVER,BASIC_SCIENCE,NONE,"Diabetes Mellitus, Type 2","DRUG, DRUG","250 mg SRT2104 Suspension, Carbon-14 radio-labeled SRT2104","Sirtris, a GSK Company",INDUSTRY,False,0,0,0,0,0
NCT02660736,Bioequivalence Study of Two Albiglutide Drug Products in Healthy Adult Subjects,COMPLETED,2016-02,2016-08,2016-08,PHASE1,59.0,INTERVENTIONAL,RANDOMIZED,CROSSOVER,TREATMENT,DOUBLE,"Diabetes Mellitus, Type 2","DRUG, DRUG, DRUG, DRUG","Albiglutide Liquid Auto-injector, Albiglutide Lyophilized DCC Pen Injector, Placebo Liquid Auto-injector, Placebo Lyophilized DCC Pen injector",GlaxoSmithKline,INDUSTRY,False,0,0,0,0,0
NCT01332071,Avandamet Bioequivalence Study Brazil - Fed Administration,COMPLETED,2009-11-24,2009-12-06,2009-12-06,PHASE1,26.0,INTERVENTIONAL,RANDOMIZED,CROSSOVER,OTHER,NONE,"Diabetes Mellitus, Type 2","DRUG, DRUG","Rosiglitazone Maleate + Metformin 2 miligrams (mg) + 500 mg, Rosiglitazone Maleate + Metformin 4 miligrams (mg) + 1000 mg",GlaxoSmithKline,INDUSTRY,True,6,6,0,0,0
NCT01135446,"Pharmacodynamics, Pharmacokinetics, Safety and Tolerability of Ultra Low Doses of Dapagliflozin in Healthy Subjects",COMPLETED,2010-05,2010-06,2010-06,PHASE1,35.0,INTERVENTIONAL,RANDOMIZED,PARALLEL,TREATMENT,NONE,Type 2 Diabetes,"DRUG, DRUG, DRUG, DRUG, DRUG, DRUG","dapagliflozin, dapagliflozin, dapagliflozin, dapagliflozin, dapagliflozin, dapagliflozin",AstraZeneca,INDUSTRY,False,0,0,0,0,0
NCT03916601,"Comparison of Exposure and Activity of SAR341402 Mix 70/30 to NovoLog Mix 70/30, NovoMix 30 and SAR341402 Rapid-acting Solution in Patients With Type 1 Diabetes Mellitus",COMPLETED,2017-12-13,2018-03-22,2018-03-22,PHASE1,52.0,INTERVENTIONAL,RANDOMIZED,CROSSOVER,TREATMENT,DOUBLE,Type 1 Diabetes,"DRUG, DRUG, DRUG, DRUG","SAR341402, Insulin Aspart, Insulin Aspart, SAR341402",Sanofi,INDUSTRY,False,0,0,0,0,0
NCT01807377,"Multiple Dose Safety Tolerability, Pharmacokinetics And Midazolam Interaction In Healthy Overweight And Obese Subjects",COMPLETED,2013-04,2013-08,2013-08,PHASE1,15.0,INTERVENTIONAL,RANDOMIZED,PARALLEL,BASIC_SCIENCE,DOUBLE,Diabetes Mellitus Type 2,"DRUG, DRUG, OTHER, DRUG","PF-05175157, Midazolam, Placebo, Midazolam",Pfizer,INDUSTRY,False,0,0,0,0,0
NCT01640873,"Safety, Tolerability, Pharmacokinetics and Pharmacodynamics of MK-8655 in Participants With Type 2 Diabetes (MK-8655-002)",COMPLETED,2012-09-19,2012-12-20,2012-12-20,PHASE1,33.0,INTERVENTIONAL,RANDOMIZED,PARALLEL,TREATMENT,DOUBLE,Type 2 Diabetes,"DRUG, DRUG","MK-8655, Placebo",Merck Sharp & Dohme LLC,INDUSTRY,True,6,3,3,1,0
NCT01538511,Insulin Profile of Biphasic Insulin Aspart 70 to That of Biphasic Insulin Aspart 30 in Healthy Volunteers,COMPLETED,2006-06-05,2007-03-13,2007-03-13,PHASE1,59.0,INTERVENTIONAL,RANDOMIZED,PARALLEL,TREATMENT,NONE,"Diabetes, Diabetes Mellitus, Type 2","DRUG, DRUG","biphasic insulin aspart 70, biphasic insulin aspart 30",Novo Nordisk A/S,INDUSTRY,False,0,0,0,0,0
NCT01088711,Evaluation of Omarigliptin (MK-3102) in Obese Participants and in Participants With Type 2 Diabetes (MK-3102-004),COMPLETED,2010-03-11,2010-05-11,2010-05-11,PHASE1,32.0,INTERVENTIONAL,RANDOMIZED,PARALLEL,TREATMENT,DOUBLE,Type 2 Diabetes (T2D),"DRUG, DRUG","Omarigliptin, Placebo",Merck Sharp & Dohme LLC,INDUSTRY,True,7,2,5,0,0
NCT02131948,Regulation of Endogenous Glucose Production by Brain Insulin Action,COMPLETED,2013-11,2014-07,2014-07,PHASE1,8.0,INTERVENTIONAL,RANDOMIZED,CROSSOVER,BASIC_SCIENCE,SINGLE,"Insulin Resistance, Diabetes","DRUG, DRUG","Intranasal insulin, Intranasal placebo","University Health Network, Toronto",OTHER,False,0,0,0,0,0
NCT00842556,Pharmacokinetic Drug Interaction Study of Dapagliflozin and Glimepiride or Sitagliptin in Healthy Subjects,COMPLETED,2009-03,2009-05,2009-05,PHASE1,18.0,INTERVENTIONAL,RANDOMIZED,CROSSOVER,TREATMENT,NONE,Type 2 Diabetes Mellitus,"DRUG, DRUG, DRUG","Dapagliflozin, Glimepiride, Sitagliptin",AstraZeneca,INDUSTRY,False,0,0,0,0,0
NCT03414736,A Study on Safety and Tolerability of SAR425899 in Overweight to Obese Subjects and Type 2 Diabetes Mellitus Patients Not Requiring Anti-Diabetic Pharmacotherapy With an Optional 6-month Safety Extension Period,COMPLETED,2018-01-19,2018-10-05,2018-10-05,PHASE1,60.0,INTERVENTIONAL,RANDOMIZED,PARALLEL,TREATMENT,NONE,Type 2 Diabetes Mellitus,DRUG,SAR425899,Sanofi,INDUSTRY,False,0,0,0,0,0
NCT02713477,Postprandial Glucodynamic Response to Insulin Glargine/Lixisenatide Fixed Ratio Combination in Japanese Patients With Type 2 Diabetes Mellitus,COMPLETED,2016-04,2016-06,2016-06,PHASE1,20.0,INTERVENTIONAL,RANDOMIZED,CROSSOVER,TREATMENT,NONE,Type 2 Diabetes Mellitus,"DRUG, DRUG, DRUG","Insulin glargine/ lixisenatide fixed-ratio combination HOE901/AVE0010, Insulin glargine HOE901, Placebo",Sanofi,INDUSTRY,False,0,0,0,0,0
NCT05294536,A Pharmacokinetic Study Comparing the Liraglutide Injection (RD12014) and Victoza® in Healthy Chinese Subjects,COMPLETED,2020-06-22,2020-11-27,2020-07-20,PHASE1,50.0,INTERVENTIONAL,RANDOMIZED,CROSSOVER,TREATMENT,NONE,Type 2 Diabetes,"DRUG, DRUG","Liraglutide injection,RD12014, Liraglutide injection,Victoza","Sunshine Lake Pharma Co., Ltd.",INDUSTRY,False,0,0,0,0,0
NCT01995656,A Study of LY3108743 in Healthy Participants and Participants With Type 2 Diabetes,COMPLETED,2013-12,2014-04,2014-04,PHASE1,44.0,INTERVENTIONAL,RANDOMIZED,CROSSOVER,BASIC_SCIENCE,DOUBLE,"Diabetes Mellitus, Type 2","DRUG, DRUG, DRUG, DRUG","Placebo - Capsule, LY3108743 - Capsule, Placebo - Solution, LY3108743 - Solution",Eli Lilly and Company,INDUSTRY,False,0,0,0,0,0
NCT04641312,A Study of LY3457263 in Healthy Participants and Participants With Type 2 Diabetes,COMPLETED,2020-11-25,2021-12-21,2021-12-21,PHASE1,67.0,INTERVENTIONAL,RANDOMIZED,PARALLEL,BASIC_SCIENCE,DOUBLE,"Healthy, Type 2 Diabetes","DRUG, DRUG, DRUG","LY3457263, Dulaglutide, Placebo",Eli Lilly and Company,INDUSTRY,False,0,0,0,0,0
NCT01581736,Molecular Regulation of Muscle Glucose Metabolism,TERMINATED,2012-04,2016-04,2016-04,PHASE1,48.0,INTERVENTIONAL,UNKNOWN,SINGLE_GROUP,BASIC_SCIENCE,NONE,"Obesity, Type 2 Diabetes Mellitus","DRUG, OTHER","U100 Humulin, Exercise",Mayo Clinic,OTHER,False,0,0,0,0,0
NCT01464320,A Study to Evaluate the Safety and Tolerability of ABT-614 and Its Effect on Kidney Function in Subjects With Type 2 Diabetes and Chronic Kidney Disease With Protein in Their Urine.,COMPLETED,2011-11,2012-04,2012-04,PHASE1,16.0,INTERVENTIONAL,RANDOMIZED,SINGLE_GROUP,TREATMENT,DOUBLE,"Type 2 Diabetics, Chronic Kidney Disease, Protein in Urine","DRUG, DRUG","ABT-614, Placebo Comparator",Abbott,INDUSTRY,False,0,0,0,0,0
NCT07039890,"To Compare and Evaluate the Oral Bioavailability of Empagliflozin + Linagliptin 10 mg/5 mg Filmcoated Tablets With That of Glyxambi 10 mg/ 5 mg Film-coated Tablets in Healthy, Adult, Human Subjects Under Fasting Conditions.",COMPLETED,2025-03-08,2025-06-05,2025-05-14,PHASE1,40.0,INTERVENTIONAL,RANDOMIZED,CROSSOVER,OTHER,NONE,Type 2 Diabetes Mellitus (T2DM),"DRUG, DRUG","Empagliflozin + Linagliptin filmcoated tablets, Glyxambi film-coated tablets",Humanis Saglık Anonim Sirketi,INDUSTRY,False,0,0,0,0,0
NCT01407003,"Safety, Tolerability, Pharmacokinetics (PK) and Pharmacodynamics (PD) Assessment of LIK066 in Healthy Subjects and in Patients With Type 2 Diabetes Mellitus (T2DM)",COMPLETED,2011-06,2013-02,2013-02,PHASE1,138.0,INTERVENTIONAL,RANDOMIZED,PARALLEL,OTHER,DOUBLE,Type 2 Diabetes Mellitus (T2DM),"DRUG, DRUG","LIK066, Placebo",Novartis Pharmaceuticals,INDUSTRY,False,0,0,0,0,0
NCT00902161,A Single-Dose Crossover Study of MK0893 in Patients With Type 2 Diabetes (0893-019 AM4)(COMPLETED),COMPLETED,2009-05,2009-11,2009-10,PHASE1,22.0,INTERVENTIONAL,RANDOMIZED,CROSSOVER,TREATMENT,DOUBLE,Type 2 Diabetes Mellitus,"DRUG, DRUG, DRUG","MK0893, MK0893-matched Placebo, Propranolol Hydrochloride (HCL)",Merck Sharp & Dohme LLC,INDUSTRY,True,5,1,4,1,0
NCT01509742,Effect of Liraglutide on Glucagon Secretion in Subjects With Type 2 Diabetes,COMPLETED,2001-04,2001-11,2001-11,PHASE1,19.0,INTERVENTIONAL,RANDOMIZED,CROSSOVER,TREATMENT,DOUBLE,"Diabetes, Diabetes Mellitus, Type 2","DRUG, DRUG","liraglutide, placebo",Novo Nordisk A/S,INDUSTRY,False,0,0,0,0,0
NCT01416324,First Time in Human Study Using GSK2330672,COMPLETED,2011-06-15,2011-09-09,2011-09-09,PHASE1,17.0,INTERVENTIONAL,RANDOMIZED,CROSSOVER,BASIC_SCIENCE,SINGLE,"Diabetes Mellitus, Type 2","DRUG, DRUG, DRUG, DRUG, DRUG, DRUG, DRUG, DRUG","placebo, 0.1 mg GSK2330672, 0.3 mg GSK2330672, 1 mg GSK2330672, 3 mg GSK2330672, 10 mg GSK2330672, 30 mg GSK2330672, 60 mg GSK2330672",GlaxoSmithKline,INDUSTRY,False,0,0,0,0,0
NCT00642798,"An Open-Label, Single- & Multiple-Dose Study to Investigate the Pharmacokinetics of Sitagliptin 100 mg in Healthy Chinese Adult Subjects (0431-108)(COMPLETED)",COMPLETED,2008-03,2008-03,2008-03,PHASE1,16.0,INTERVENTIONAL,NON_RANDOMIZED,SINGLE_GROUP,TREATMENT,NONE,Diabetes Mellitus Non-insulin-dependent,DRUG,sitagliptin phosphate,Merck Sharp & Dohme LLC,INDUSTRY,False,0,0,0,0,0
NCT02877355,Investigation of the Effect of Upper Gastrointestinal Disease on the Pharmacokinetics of Oral Semaglutide in Subjects With Type 2 Diabetes.,COMPLETED,2016-08-22,2017-11-24,2017-11-24,PHASE1,55.0,INTERVENTIONAL,UNKNOWN,SINGLE_GROUP,TREATMENT,NONE,"Diabetes, Diabetes Mellitus, Type 2",DRUG,semaglutide,Novo Nordisk A/S,INDUSTRY,False,0,0,0,0,0
NCT02672839,A Comparison Study of the Bioavailability of a Capsule Formulation of LGD-6972 to an Oral Solution Formulation,COMPLETED,2016-02,2016-05,2016-05,PHASE1,12.0,INTERVENTIONAL,RANDOMIZED,CROSSOVER,TREATMENT,NONE,Type 2 Diabetes Mellitus (T2DM),"DRUG, DRUG","LGD-6972 Solution, LGD-6972 Capsules",Ligand Pharmaceuticals,INDUSTRY,False,0,0,0,0,0
NCT05977465,Empagliflozin in Treatment of Peripheral Diabetic Neuropathy,COMPLETED,2022-01-20,2023-08-03,2023-08-01,PHASE1,50.0,INTERVENTIONAL,RANDOMIZED,PARALLEL,TREATMENT,NONE,Diabetic Neuropathy Peripheral,DRUG,Empagliflozin 25 MG,Tanta University,OTHER,False,0,0,0,0,0
NCT01217905,"Japanese Single and Multiple Ascending Dose, Safety, Tolerability, Pharmacokinetic (PK) & Pharmacodynamic (PD) Study of AZD7687",COMPLETED,2010-11,2011-07,2011-07,PHASE1,36.0,INTERVENTIONAL,RANDOMIZED,SINGLE_GROUP,BASIC_SCIENCE,DOUBLE,"Type 2 Diabetes, Obesity",DRUG,AZD7687,AstraZeneca,INDUSTRY,False,0,0,0,0,0
NCT01686828,T-IR- Study to Understand the Effects of Testosterone and Estrogen on the Body's Response to the Hormone Insulin,COMPLETED,2013-06,2017-12,2015-05,PHASE1,53.0,INTERVENTIONAL,RANDOMIZED,PARALLEL,TREATMENT,DOUBLE,"Insulin Resistance, Type 2 Diabetes Mellitus, Obesity, Androgen Deficiency, Metabolic Disease","DRUG, DRUG, DRUG, DRUG, DRUG","Acyline, Testosterone 1.62% gel, Letrozole, Placebo gel (for Testosterone 1.62% gel), Placebo pill (for Letrozole)",University of Washington,OTHER,True,3,1,2,1,0
