nct_id,title,status,start_date,completion_date,primary_completion_date,phase,enrollment,study_type,allocation,intervention_model,primary_purpose,masking,conditions,intervention_types,intervention_names,sponsor,sponsor_type,has_results,num_outcome_measures,num_primary_outcomes,num_secondary_outcomes,num_p_values_in_primary,enrollment_missing
NCT01369277,"A Single Dose Study In Japanese And Western Healthy Subjects To Investigate The Safety, Tolerability And Pharmacokinetics Of PF-04991532",COMPLETED,2011-06,2011-09,2011-09,PHASE1,22.0,INTERVENTIONAL,RANDOMIZED,PARALLEL,TREATMENT,DOUBLE,"Diabetes Mellitus, Diabetes Mellitus, Type 2, Glucose Metabolism Disorders","DRUG, DRUG, DRUG","PF-04991532, Placebo, PF-04991532",Pfizer,INDUSTRY,False,0,0,0,0,0
NCT02862431,"Study to Assess Safety, Tolerability, Pharmacokinetics and Pharmacodynamics of JNJ-64565111 in Type 2 Diabetes Mellitus (T2DM)",TERMINATED,2016-07-12,2016-12-05,2016-11-29,PHASE1,24.0,INTERVENTIONAL,RANDOMIZED,PARALLEL,TREATMENT,DOUBLE,"Diabetes Mellitus, Type 2","DRUG, DRUG","JNJ-64565111, Placebo","Janssen Research & Development, LLC",INDUSTRY,False,0,0,0,0,0
NCT06386328,A Clinical Trial to Evaluate the Food Effect of CKD-378,COMPLETED,2024-05-03,2024-06-13,2024-06-03,PHASE1,31.0,INTERVENTIONAL,RANDOMIZED,CROSSOVER,TREATMENT,NONE,Type II Diabetes Mellitus,DRUG,"CKD-378, QD, PO",Chong Kun Dang Pharmaceutical,INDUSTRY,False,0,0,0,0,0
NCT01340911,A Study in Healthy Male Volunteers to Investigate Different Doses of a New Drug for the Treatment of Metabolic Diseases,COMPLETED,2011-06-03,2011-11-24,2011-11-24,PHASE1,78.0,INTERVENTIONAL,RANDOMIZED,PARALLEL,BASIC_SCIENCE,SINGLE,"Diabetes Mellitus, Type 2","DRUG, DRUG","SRT3025, Placebo","Sirtris, a GSK Company",INDUSTRY,False,0,0,0,0,0
NCT03903016,A Bioequivalence Study Comparing Two Different Strengths Formulations of Insulin Lispro in Patients With Type 1 Diabetes,COMPLETED,2019-03-26,2019-08-19,2019-08-19,PHASE1,90.0,INTERVENTIONAL,RANDOMIZED,CROSSOVER,TREATMENT,QUADRUPLE,Type 1 Diabetes,"DRUG, DRUG","Insulin Lispro SAR342434, Insulin Lispro SAR342434",Sanofi,INDUSTRY,False,0,0,0,0,0
NCT03417076,Absolute Bioavailability Study With Bexagliflozin,WITHDRAWN,2018-08-01,2018-09-16,2018-09-16,PHASE1,0.0,INTERVENTIONAL,UNKNOWN,SINGLE_GROUP,TREATMENT,NONE,Type 2 Diabetes Mellitus,DRUG,Bexagliflozin,Theracos,INDUSTRY,False,0,0,0,0,0
NCT07020949,"Multiple Dose Study to Investigate the Safety, Tolerability, Pharmacokinetics, and Efficacy of THDBH120 in Chinese Patients With T2DM",COMPLETED,2024-06-13,2024-11-27,2024-11-27,PHASE1,49.0,INTERVENTIONAL,RANDOMIZED,PARALLEL,TREATMENT,DOUBLE,Diabetes Mellitus Type 2,"DRUG, DRUG","THDBH120 injection, Placebo of THDBH120 injection","Tonghua Dongbao Pharmaceutical Co.,Ltd",INDUSTRY,False,0,0,0,0,0
NCT06948747,"A Study to Investigate the Effect of AZD5004 on Rosuvastatin, Atorvastatin, Simvastatin, Repaglinide and the Effect of Erythromycin on AZD5004 in Healthy Participants",COMPLETED,2025-05-06,2025-10-03,2025-10-03,PHASE1,49.0,INTERVENTIONAL,NON_RANDOMIZED,FACTORIAL,TREATMENT,NONE,Healthy Participants,"DRUG, DRUG, DRUG, DRUG, DRUG, DRUG","AZD5004, Rosuvastatin, Erythromycin, Atorvastatin, Simvastatin, Repaglinide",AstraZeneca,INDUSTRY,False,0,0,0,0,0
NCT04426708,A Clinical Study to Access the Pharmacokinetics of HMS5552 in Hepatic Impaired Subjects and Healthy Volunteers,COMPLETED,2019-02-18,2020-07-03,2020-07-03,PHASE1,25.0,INTERVENTIONAL,NON_RANDOMIZED,PARALLEL,TREATMENT,NONE,Type 2 Diabetes Mellitus,DRUG,HMS5552,Hua Medicine Limited,INDUSTRY,False,0,0,0,0,0
NCT04142424,"A Study to Understand the Safety, Tolerability, and Activity of Drug in Body Over a Period of Time of AZD2693, in Subjects of Non-Childbearing Potential in Overweight But Otherwise Healthy Subjects, and Healthy Chinese and Japanese Subjects",COMPLETED,2019-10-28,2021-11-12,2021-11-12,PHASE1,73.0,INTERVENTIONAL,RANDOMIZED,PARALLEL,TREATMENT,TRIPLE,"Metabolic Disorders, Non-alcoholic Steatohepatitis","DRUG, DRUG","AZD2693, Placebo",AstraZeneca,INDUSTRY,False,0,0,0,0,0
NCT00961480,A Study to Demonstrate the Bioequivalence of Sitagliptin/Metformin Combination Tablets and Co-administration of Sitagliptin and Metformin as Individual Tablets (0431A-095),COMPLETED,2007-10,2007-11,2007-11,PHASE1,24.0,INTERVENTIONAL,RANDOMIZED,CROSSOVER,TREATMENT,NONE,Type 2 Diabetes,"DRUG, DRUG, DRUG, DRUG, DRUG, DRUG, DRUG, DRUG","sitagliptin phosphate (+) metformin hydrochloride, Comparator: metformin 500mg, Comparator: sitagliptin, Comparator: FMI sitagliptin / metformin 50 mg/500 mg FDC tablet, Comparator: FMI sitagliptin/metformin 50 mg/1000 mg FDC tablet, Comparator: FMI sitagliptin/metformin 50 mg/850 mg FDC tablet, Comparator: metformin 1000 mg, Comparator: metformin 850 mg",Merck Sharp & Dohme LLC,INDUSTRY,False,0,0,0,0,0
NCT05029076,Human Bioequivalence Test of Liraglutide Injection,COMPLETED,2019-05-21,2019-07-01,2019-06-01,PHASE1,28.0,INTERVENTIONAL,RANDOMIZED,CROSSOVER,TREATMENT,NONE,Type 2 Diabetes,"DRUG, DRUG","Liraglutide injection, Victoza","Chia Tai Tianqing Pharmaceutical Group Co., Ltd.",INDUSTRY,False,0,0,0,0,0
NCT01083212,To Evaluate the Effect of Gemfibrozil on the Pharmacokinetics and Pharmacodynamics of a Single Dose of AZD1656,COMPLETED,2010-03,2010-06,2010-06,PHASE1,19.0,INTERVENTIONAL,RANDOMIZED,CROSSOVER,TREATMENT,NONE,Type 2 Diabetes Mellitus,"DRUG, DRUG, DRUG","AZD1656, Gemfibrozil, Placebo",AstraZeneca,INDUSTRY,False,0,0,0,0,0
NCT01043965,Myocardial Perfusion in Type 2 Diabetes,COMPLETED,2005-08,2009-08,2009-08,PHASE1,61.0,INTERVENTIONAL,NON_RANDOMIZED,SINGLE_GROUP,DIAGNOSTIC,SINGLE,Type 2 Diabetes,DRUG,Metformin,University of Sao Paulo General Hospital,OTHER,False,0,0,0,0,0
NCT00790556,"A Study to Evaluate the Safety, Tolerability, Pharmacokinetics and Pharmacodynamics of MK8245 (8245-004)(COMPLETED)",COMPLETED,2008-10,2009-09,2009-09,PHASE1,14.0,INTERVENTIONAL,RANDOMIZED,CROSSOVER,TREATMENT,DOUBLE,Type 2 Diabetes,"DRUG, DRUG","MK8245, Comparator: Placebo",Merck Sharp & Dohme LLC,INDUSTRY,True,3,2,0,0,0
NCT01500798,A Pharmacodynamic Study of Measured Glomerular Filtration Rate in Patients With Chronic Kidney Disease and Type 2 Diabetes,TERMINATED,2012-01-31,2013-10-01,2012-11-01,PHASE1,18.0,INTERVENTIONAL,RANDOMIZED,PARALLEL,TREATMENT,QUADRUPLE,"Chronic Kidney Disease, Type 2 Diabetes","DRUG, DRUG","20 mg bardoxolone methyl, Placebo",Biogen,INDUSTRY,False,0,0,0,0,0
NCT04050553,A Study of Tirzepatide in Participants With Type 2 Diabetes Mellitus,COMPLETED,2020-02-24,2022-01-25,2022-01-25,PHASE1,42.0,INTERVENTIONAL,RANDOMIZED,CROSSOVER,BASIC_SCIENCE,DOUBLE,"Diabetes Mellitus, Type 2, Hypoglycemia","DRUG, DRUG","Tirzepatide, Placebo",Eli Lilly and Company,INDUSTRY,True,7,1,6,1,0
NCT01798264,"Open Label, 4 Week Study of ITCA 650 in Adults With Type 2 Diabetes",COMPLETED,2009-02,2009-05,2009-05,PHASE1,44.0,INTERVENTIONAL,RANDOMIZED,PARALLEL,TREATMENT,NONE,Type 2 Diabetes,DRUG,ITCA 650 (exenatide in DUROS),Intarcia Therapeutics,INDUSTRY,True,4,1,3,0,0
NCT00943371,A Single-Dose Study of MK6349 in Patients With Type 2 Diabetes (6349-002),TERMINATED,2007-08,2009-05,2007-09,PHASE1,28.0,INTERVENTIONAL,RANDOMIZED,PARALLEL,TREATMENT,DOUBLE,Type 2 Diabetes Mellitus,"DRUG, DRUG","MK6349, Comparator: Placebo to MK6349",Merck Sharp & Dohme LLC,INDUSTRY,False,0,0,0,0,0
NCT00254800,The Effects of Exenatide on Oral Contraceptive Pharmacokinetics in Healthy Females,COMPLETED,2005-11,2006-08,2006-08,PHASE1,38.0,INTERVENTIONAL,RANDOMIZED,CROSSOVER,TREATMENT,NONE,Type 2 Diabetes Mellitus,"DRUG, DRUG, DRUG","ethinyl estradiol and levonorgestrel; exenatide, ethinyl estradiol and levonorgestrel; exenatide, ethinyl estradiol and levonorgestrel; exenatide",AstraZeneca,INDUSTRY,False,0,0,0,0,0
NCT02815787,The Drug -Drug Interaction of SP2086 and Glyburide,COMPLETED,2014-03,2014-07,2014-07,PHASE1,16.0,INTERVENTIONAL,RANDOMIZED,CROSSOVER,TREATMENT,NONE,Type 2 Diabetes,"DRUG, DRUG","SP2086, Glyburide","Jiangsu HengRui Medicine Co., Ltd.",INDUSTRY,False,0,0,0,0,0
NCT06634927,"Pharmacokinetic Similarity, Safety, and Immunogenicity of Semaglutide Injection and Ozempic ® Injection in Healthy Subjects.",COMPLETED,2024-09-22,2025-02-12,2024-11-14,PHASE1,68.0,INTERVENTIONAL,RANDOMIZED,PARALLEL,TREATMENT,NONE,Type 2 Diabetes,"DRUG, DRUG","Ozempic®, HDG1901","Hangzhou Zhongmei Huadong Pharmaceutical Co., Ltd.",INDUSTRY,False,0,0,0,0,0
NCT01804842,Assessing the Effect of Met DR on Plasma Glucose and PK in Subjects With T2DM,COMPLETED,2012-12,2013-04,2013-04,PHASE1,26.0,INTERVENTIONAL,RANDOMIZED,CROSSOVER,BASIC_SCIENCE,NONE,Type 2 Diabetes Mellitus,DRUG,Met DR,"Elcelyx Therapeutics, Inc.",INDUSTRY,True,4,4,0,12,0
NCT05549570,Comparative Bioavailability Study of Metformin/Sitagliptin 850 mg/50 mg Tablets in Healthy Male and Female Volunteers,COMPLETED,2017-10-22,2017-11-01,2017-11-01,PHASE1,26.0,INTERVENTIONAL,RANDOMIZED,CROSSOVER,OTHER,NONE,"Bioequivalence, Diabetes Mellitus, Type 2",DRUG,Sitagliptin/Metformin HCl 50/850 mg film-coated tablet,Galenicum Health,INDUSTRY,False,0,0,0,0,0
NCT01809184,"A Trial Investigating the Safety, Tolerability, Pharmacokinetics and Pharmacodynamics of NNC0148-0000-0287 in Healthy Subjects",COMPLETED,2013-03-04,2013-09-06,2013-09-06,PHASE1,84.0,INTERVENTIONAL,RANDOMIZED,PARALLEL,TREATMENT,DOUBLE,"Diabetes, Diabetes Mellitus, Type 2","DRUG, DRUG, DRUG","insulin 287, insulin glargine, placebo",Novo Nordisk A/S,INDUSTRY,False,0,0,0,0,0
NCT02815748,The Metabolite Identification and Material Balance Study of SP2086,COMPLETED,2015-08,2015-10,2015-10,PHASE1,8.0,INTERVENTIONAL,UNKNOWN,SINGLE_GROUP,TREATMENT,NONE,Type 2 Diabetes,DRUG,SP2086,"Jiangsu HengRui Medicine Co., Ltd.",INDUSTRY,False,0,0,0,0,0
NCT01068743,Bioequivalence Study of Fixed Dose Combination of 2.5 mg Saxagliptin/850 mg Metformin Tablet Relative to 2.5 mg Onglyza and 850 mg Glucophage Tablets Co-Administered,COMPLETED,2010-02,2010-03,2010-03,PHASE1,24.0,INTERVENTIONAL,RANDOMIZED,CROSSOVER,TREATMENT,NONE,Type 2 Diabetes Mellitus,"DRUG, DRUG, DRUG","saxagliptin, metformin, saxagliptin + metformin (FDC tablet)",AstraZeneca,INDUSTRY,True,17,4,7,0,0
NCT02942914,A Study of LY3209590 in Healthy Participants and Participants With Type 2 Diabetes,COMPLETED,2016-12-20,2017-10-18,2017-10-18,PHASE1,80.0,INTERVENTIONAL,RANDOMIZED,PARALLEL,BASIC_SCIENCE,DOUBLE,"Diabetes Mellitus, Type 2","DRUG, DRUG, DRUG","LY3209590, Placebo, Insulin Glargine",Eli Lilly and Company,INDUSTRY,False,0,0,0,0,0
NCT00562250,Pharmacokinetic Drug Interaction Study With Dapagliflozin and Glimepiride in Healthy Subjects,COMPLETED,2008-05,2008-08,2008-08,PHASE1,11.0,INTERVENTIONAL,RANDOMIZED,CROSSOVER,TREATMENT,NONE,"Diabetes Mellitus, Type 2","DRUG, DRUG, DRUG","Dapagliflozin, Glimepiride, Dapagliflozin + Glimepiride",AstraZeneca,INDUSTRY,False,0,0,0,0,0
NCT01183715,A Single Dose Study Of PF-05161704 In Healthy Volunteers,COMPLETED,2010-07,2010-09,2010-09,PHASE1,18.0,INTERVENTIONAL,RANDOMIZED,CROSSOVER,BASIC_SCIENCE,DOUBLE,"Diabetes Mellitus, Type 2","DRUG, DRUG","PF-05161704 or placebo, PF-05161704 or placebo",Pfizer,INDUSTRY,False,0,0,0,0,0
NCT01511692,Effect of Liraglutide Compared to Glimepiride on Appetite in Subjects With Type 2 Diabetes,COMPLETED,2005-11,2007-09,2007-09,PHASE1,43.0,INTERVENTIONAL,RANDOMIZED,CROSSOVER,TREATMENT,DOUBLE,"Diabetes, Diabetes Mellitus, Type 2","DRUG, DRUG, DRUG, DRUG","liraglutide, placebo, placebo, glimepiride",Novo Nordisk A/S,INDUSTRY,False,0,0,0,0,0
NCT01253304,A Single Dose Study of LY2189265 in Subjects With Varying Degrees of Hepatic (Liver) Impairment,COMPLETED,2010-11,2011-11,2011-11,PHASE1,26.0,INTERVENTIONAL,NON_RANDOMIZED,SINGLE_GROUP,TREATMENT,NONE,"Diabetes Mellitus, Type 2",DRUG,LY2189265,Eli Lilly and Company,INDUSTRY,True,7,7,0,0,0
NCT02627287,A Comparative Trial Focusing on Injections With the Medical Device DV3316 Pen-injector Versus FlexPen®,COMPLETED,2015-12-01,2016-02-25,2016-02-25,PHASE1,150.0,INTERVENTIONAL,RANDOMIZED,CROSSOVER,OTHER,DOUBLE,"Diabetes, Diabetes Mellitus, Type 1, Diabetes Mellitus, Type 2","DEVICE, DEVICE, DRUG","FlexPen®, DV3316 pen-injector, placebo",Novo Nordisk A/S,INDUSTRY,False,0,0,0,0,0
NCT00975052,A Study of the Effects of Sitagliptin (MK0431) and Metformin on Incretin Hormone Concentrations (0431-050)(COMPLETED),COMPLETED,2006-01,2006-03,2006-03,PHASE1,16.0,INTERVENTIONAL,RANDOMIZED,CROSSOVER,TREATMENT,DOUBLE,Type 2 Diabetes,"DRUG, DRUG, DRUG, DRUG","sitagliptin phosphate, Comparator: metformin, Comparator: sitagliptin and metformin, Comparator: placebo",Merck Sharp & Dohme LLC,INDUSTRY,False,0,0,0,0,0
NCT02324309,BIOD-531 vs. Humalog Mix 75/25 vs. Humulin R U-500 Post-Meal Glucose Control in Patients With Severe Insulin Resistance,COMPLETED,2014-05,2014-11,2014-11,PHASE1,12.0,INTERVENTIONAL,RANDOMIZED,CROSSOVER,TREATMENT,SINGLE,Diabetes Mellitus,"DRUG, DRUG, DRUG, DRUG","BIOD-531, Humalog Mix 75/25, Humulin R U-500, BIOD-531",Biodel,INDUSTRY,False,0,0,0,0,0
NCT02735239,Study of Anti-PD-L1 in Combination With Chemo(Radio)Therapy for Oesophageal Cancer,COMPLETED,2016-06-24,2022-06-16,2022-06-16,PHASE1,73.0,INTERVENTIONAL,NON_RANDOMIZED,PARALLEL,TREATMENT,NONE,Esophageal Cancer,"DRUG, DRUG, DRUG, DRUG, RADIATION, DRUG, DRUG, DRUG, DRUG, DRUG","Durvalumab, Tremelimumab, Oxaliplatin, Capecitabine, Radiotherapy, Paclitaxel, Carboplatin, 5-fluorouracil (5-FU), Leucovorin, Docetaxel",Ludwig Institute for Cancer Research,OTHER,True,7,2,5,0,0
NCT01865292,Comparing the Pharmacodynamics and Pharmacokinetics of Explorative Formulation of Insulin Degludec With Insulin Glargine in Subjects With Type 1 and Type 2 Diabetes,COMPLETED,2006-08,2006-11,2006-11,PHASE1,40.0,INTERVENTIONAL,RANDOMIZED,CROSSOVER,TREATMENT,DOUBLE,"Diabetes, Diabetes Mellitus, Type 1, Diabetes Mellitus, Type 2","DRUG, DRUG","insulin degludec, insulin glargine",Novo Nordisk A/S,INDUSTRY,False,0,0,0,0,0
NCT02749032,Feed-Back Suppression of Meal-Induced Glucagon-like Peptide 1 (GLP-1) Secretion,COMPLETED,2011-11,2014-03,2014-03,PHASE1,24.0,INTERVENTIONAL,RANDOMIZED,CROSSOVER,TREATMENT,TRIPLE,Type 2 Diabetes,"OTHER, DRUG, DRUG, DRUG, DRUG, OTHER","Mixed meal test, Vildagliptin, Sitagliptin, Placebo, Metformin, Diet and exercise",Michael A. Nauck,OTHER,False,0,0,0,0,0
NCT02212067,A Trial Investigating the Effects of Semaglutide on ß-cell Function in Subjects With Type 2 Diabetes,COMPLETED,2014-08-11,2015-05-11,2015-05-11,PHASE1,87.0,INTERVENTIONAL,RANDOMIZED,PARALLEL,TREATMENT,DOUBLE,"Diabetes, Diabetes Mellitus, Type 2","DRUG, DRUG","semaglutide, placebo",Novo Nordisk A/S,INDUSTRY,False,0,0,0,0,0
NCT00912002,"A Study of Absorption, Metabolism, Excretion and Mass Balance After a Single Dose Administration of MK-0941 (MK-0941-016)(COMPLETED)",COMPLETED,2008-10,2009-01,2008-11,PHASE1,6.0,INTERVENTIONAL,UNKNOWN,SINGLE_GROUP,TREATMENT,NONE,Type 2 Diabetes,DRUG,MK-0941,Merck Sharp & Dohme LLC,INDUSTRY,True,3,1,2,0,0
NCT01755442,Investigate Effect of AMG 151 on 24-hour Ambulatory Blood Pressure & Glucose Levels in Type 2 Diabetes Mellitus Subjects,TERMINATED,2012-11,2013-01,2013-01,PHASE1,5.0,INTERVENTIONAL,RANDOMIZED,CROSSOVER,TREATMENT,DOUBLE,Diabetes Mellitus,"OTHER, DRUG","Placebo, AMG 151",Amgen,INDUSTRY,False,0,0,0,0,0
NCT03310749,An Assessment of Pharmacokinetic Gemigliptin and Metformin Interactions in Healthy Mexican Volunteers,COMPLETED,2016-01-15,2016-05-03,2016-05-03,PHASE1,34.0,INTERVENTIONAL,RANDOMIZED,CROSSOVER,TREATMENT,NONE,"Diabetes Mellitus, Type 2","DRUG, DRUG, DRUG","Gemigliptin, Gemigliptin 50 mg q.d. + metformin 1000 mg twice a day, Metformin","Stendhal Americas, S.A.",INDUSTRY,False,0,0,0,0,0
NCT06247748,"Influence of JY09 on Pharmacokinetics of Metformin , Rosuvastatin , and Digoxin and the QT Interval Study in Overweight Chinese Subjects",COMPLETED,2023-10-19,2024-04-15,2024-04-15,PHASE1,28.0,INTERVENTIONAL,NON_RANDOMIZED,CROSSOVER,TREATMENT,NONE,"Diabetes Mellitus, Type 2, Overweight","DRUG, DRUG, DRUG, DRUG","Exendin-4 Fc fusion protein (JY09) injection, Metformin Hydrochloride tablet, Rosuvastatin calcium tablets, Digoxin tablet","Beijing Dongfang Biotech Co., Ltd.",INDUSTRY,False,0,0,0,0,0
NCT04540016,Mass Balance and Biotransformation of [14C]HSK7653 in Human,COMPLETED,2020-11-15,2021-01-21,2021-01-14,PHASE1,6.0,INTERVENTIONAL,UNKNOWN,SINGLE_GROUP,TREATMENT,NONE,Type II Diabetes,DRUG,[14C]HSK7653,"Sichuan Haisco Pharmaceutical Group Co., Ltd",INDUSTRY,False,0,0,0,0,0
NCT01511185,Effect of Liraglutide on the Beta-cell Responsiveness in Subjects With Type 2 Diabetes Compared to a Healthy Control Group,COMPLETED,2001-02,2001-10,2001-10,PHASE1,20.0,INTERVENTIONAL,RANDOMIZED,CROSSOVER,TREATMENT,DOUBLE,"Diabetes, Diabetes Mellitus, Type 2","DRUG, DRUG","liraglutide, placebo",Novo Nordisk A/S,INDUSTRY,False,0,0,0,0,0
NCT04016974,A Research Study of How Oral Semaglutide Tablets Work in Healthy People Who Are Chinese,COMPLETED,2019-10-08,2021-02-26,2021-01-23,PHASE1,32.0,INTERVENTIONAL,RANDOMIZED,PARALLEL,TREATMENT,QUADRUPLE,"Healthy Volunteers, Diabetes Mellitus, Type 2","DRUG, DRUG","Oral semaglutide, Placebo",Novo Nordisk A/S,INDUSTRY,False,0,0,0,0,0
NCT01952535,"A Clinical Study to Evaluate Safety, Tolerability and Pharmacokinetics of Oral HMS5552 in Healthy Volunteers",COMPLETED,2013-09,2013-12,2013-12,PHASE1,60.0,INTERVENTIONAL,RANDOMIZED,PARALLEL,TREATMENT,DOUBLE,Type II Diabetes Mellitus,"DRUG, DRUG","HMS5552, Placebo",Hua Medicine Limited,INDUSTRY,False,0,0,0,0,0
NCT02029924,"A Double-blinded, Randomised, Two -Period Crossover Euglycemic Clamp Trial Investigating the Pharmacokinetics, Glucodynamics and Safety of BioChaperone Insulin Lispro and Insulin Lispro (Humalog®) in Subjects With Type 1 Diabetes",COMPLETED,2013-12,2014-08,2014-03,PHASE1,37.0,INTERVENTIONAL,RANDOMIZED,CROSSOVER,TREATMENT,DOUBLE,Diabetes Mellitus Type 1,"DRUG, DRUG","BioChaperone insulin lispro, Humalog®",Adocia,INDUSTRY,False,0,0,0,0,0
NCT00418366,A Study on the Effect of Kidney Disease on a Diabetes Medication (0431-008),COMPLETED,2003-01,2003-03,2003-03,PHASE1,24.0,INTERVENTIONAL,NON_RANDOMIZED,PARALLEL,TREATMENT,NONE,"Renal Insufficiency, Hemodialysis",DRUG,"MK0431, sitagliptin phosphate / Duration of Treatment : 1 Days",Merck Sharp & Dohme LLC,INDUSTRY,False,0,0,0,0,0
NCT01843127,A Study to Evaluate the Effect of Ranolazine on Postprandial Glucagon in Subjects With Type 2 Diabetes.,COMPLETED,2013-04,2013-09,2013-09,PHASE1,24.0,INTERVENTIONAL,RANDOMIZED,CROSSOVER,TREATMENT,SINGLE,Type 2 Diabetes Mellitus,"DRUG, DRUG, DRUG","Ranolazine, Placebo, Exenatide",Gilead Sciences,INDUSTRY,False,0,0,0,0,0
NCT00964262,A Study to Evaluate Safety and Pharmacokinetics/Pharmacodynamics of Sustained Release(SR) Exenatide,COMPLETED,2009-08,2010-10,2010-10,PHASE1,34.0,INTERVENTIONAL,RANDOMIZED,SINGLE_GROUP,TREATMENT,TRIPLE,Type 2 Diabetes Mellitus,"DRUG, DRUG","SR Exenatide (PT302), Placebo","Peptron, Inc.",INDUSTRY,False,0,0,0,0,0
NCT00377442,A Drug-Drug Interaction Study of GK Activator (2) and Simvastatin in Patients With Type 2 Diabetes.,COMPLETED,2006-08,2007-04,2007-04,PHASE1,33.0,INTERVENTIONAL,RANDOMIZED,CROSSOVER,TREATMENT,NONE,Diabetes Mellitus Type 2,"DRUG, DRUG","GK Activator (2), Simvastatin",Hoffmann-La Roche,INDUSTRY,False,0,0,0,0,0
NCT02210871,"Investigating the Pharmacokinetics, Safety and Tolerability After a Single Subcutaneous Injection of Semaglutide in Subjects With Mild, Moderate or Severe Hepatic Impairment Compared to Subjects With Normal Hepatic Function",COMPLETED,2014-08-07,2015-06-03,2015-06-03,PHASE1,44.0,INTERVENTIONAL,RANDOMIZED,PARALLEL,TREATMENT,NONE,"Diabetes, Diabetes Mellitus, Type 2, Hepatic Impaired",DRUG,semaglutide,Novo Nordisk A/S,INDUSTRY,False,0,0,0,0,0
NCT03859934,Metabolic Effects of Melatonin Treatment,COMPLETED,2019-09-26,2021-08-18,2021-05-03,PHASE1,17.0,INTERVENTIONAL,RANDOMIZED,CROSSOVER,TREATMENT,TRIPLE,"Metabolic Disease, Insulin Sensitivity, Glucose Metabolism Disorders (Including Diabetes Mellitus), Type 2 Diabetes Mellitus, Blood Pressure, Inflammation","DRUG, DRUG","Melatonin, Placebo Oral Tablet",University of Aarhus,OTHER,False,0,0,0,0,0
NCT03790787,Drug Interaction Study Between Dorzagliatin and Empagliflozin,COMPLETED,2019-04-18,2020-03-15,2020-03-15,PHASE1,16.0,INTERVENTIONAL,UNKNOWN,SEQUENTIAL,TREATMENT,NONE,Patients,"DRUG, DRUG","Empagliflozin, Dorzagliatin",Hua Medicine Limited,INDUSTRY,False,0,0,0,0,0
NCT01366287,A Study Of PF-03882845 Absorption In Healthy Volunteers Given Orally As Tablet Versus Suspension Formulations And Effect Of Food On Its Absorption,COMPLETED,2011-01,2011-02,2011-02,PHASE1,12.0,INTERVENTIONAL,RANDOMIZED,CROSSOVER,BASIC_SCIENCE,NONE,"Diabetes Mellitus, Type 2","DRUG, DRUG, DRUG","PF-03882845, PF-03882845, PF-03882845",Pfizer,INDUSTRY,False,0,0,0,0,0
NCT00970593,"Study Evaluating Safety, Tolerability, And Action Of OAP-189 In Subjects With Type 2 Diabetes On Metformin",COMPLETED,2009-09-02,2011-07-25,2011-07-25,PHASE1,92.0,INTERVENTIONAL,RANDOMIZED,PARALLEL,TREATMENT,TRIPLE,Diabetes Mellitus,"DRUG, DRUG","OAP-189, placebo comparator",Pfizer,INDUSTRY,True,14,10,0,0,0
NCT00806338,"An Ascending Multi-Dose, Tolerance and Pharmacokinetic Study in Obese or Overweight Type 2 Diabetic Volunteers",COMPLETED,2008-11,2009-04,2009-04,PHASE1,22.0,INTERVENTIONAL,RANDOMIZED,SINGLE_GROUP,TREATMENT,QUADRUPLE,"Diabetes Mellitus, Obesity","DRUG, DRUG","Trodusquemine (MSI-1436), Placebo",Genaera Corporation,INDUSTRY,False,0,0,0,0,0
NCT00332085,Pilot Trial of Chromium-Metformin Combination in Type 2 Diabetes,TERMINATED,2006-01,2007-03,2007-03,PHASE1,40.0,INTERVENTIONAL,RANDOMIZED,SINGLE_GROUP,TREATMENT,DOUBLE,Type 2 Diabetes,DRUG,Chromium Picolinate,Bastyr University,OTHER,False,0,0,0,0,0
NCT05266404,Phase 1 Bioequivalence Study of Dapagliflozin/Sitagliptin FDC vs Loose Combination of Single Components,COMPLETED,2022-03-21,2022-05-31,2022-05-31,PHASE1,46.0,INTERVENTIONAL,RANDOMIZED,CROSSOVER,TREATMENT,NONE,Healthy Volunteers (Intended Indication: Type 2 Diabetes Mellitus),"DRUG, DRUG, DRUG","Dapagliflozin/sitagliptin FDC, Sitagliptin, Dapagliflozin",AstraZeneca,INDUSTRY,False,0,0,0,0,0
NCT00504816,A Study of the Effects of GSK189075 on PK Profiles of an Oral Contraceptive Pill When Given to Healthy Female Volunteers,COMPLETED,2007-04,2008-04,2008-01,PHASE1,22.0,INTERVENTIONAL,NON_RANDOMIZED,SINGLE_GROUP,TREATMENT,NONE,"Type 2 Diabetes Mellitus, Diabetes Mellitus, Type 2","DRUG, DRUG","GSK189075, Brevicon",GlaxoSmithKline,INDUSTRY,False,0,0,0,0,0
NCT02077452,"Safety, Tolerability, Pharmacokinetics and Pharmacodynamics of HMS5552 in Patients With Type 2 Diabetes",COMPLETED,2014-03,2014-10,2014-09,PHASE1,53.0,INTERVENTIONAL,RANDOMIZED,SINGLE_GROUP,TREATMENT,QUADRUPLE,Type 2 Diabetes Mellitus,"DRUG, DRUG","HMS5552, Placebo",Hua Medicine Limited,INDUSTRY,False,0,0,0,0,0
NCT00930865,Study to Evaluate the Potential Pharmacokinetic Interaction and Pharmacodynamic Effects on Renal Parameters of Bumetanide (1mg) and Dapagliflozin (10 mg) When Co-administered in Healthy Subjects,COMPLETED,2009-07,2009-09,2009-09,PHASE1,42.0,INTERVENTIONAL,RANDOMIZED,PARALLEL,TREATMENT,NONE,Type 2 Diabetes Mellitus,"DRUG, DRUG","Bumetanide, Dapagliflozin",AstraZeneca,INDUSTRY,False,0,0,0,0,0
NCT03296800,"Study to Evaluate Effects of Probenecid, Rifampin and Verapamil on Bexagliflozin in Healthy Subjects",COMPLETED,2017-09-27,2017-12-06,2017-12-06,PHASE1,48.0,INTERVENTIONAL,NON_RANDOMIZED,SINGLE_GROUP,TREATMENT,NONE,Type 2 Diabetes Mellitus,"DRUG, DRUG, DRUG, DRUG","Bexagliflozin, Probenecid, Rifampin, Verapamil",Theracos,INDUSTRY,True,5,4,1,0,0
NCT06615700,"Phase 1 to Study Safety, Tolerability, Pharmacokinetics, and Pharmacodynamics of NA-931 in Obese Participants and Patients With Type 2 Diabetes Mellitus",COMPLETED,2024-05-06,2024-09-20,2024-08-12,PHASE1,74.0,INTERVENTIONAL,RANDOMIZED,PARALLEL,TREATMENT,TRIPLE,"Overweight or Obesity, Type 2 Diabetes","DRUG, DRUG","NA-931, Placebo","Biomed Industries, Inc.",INDUSTRY,False,0,0,0,0,0
NCT00495014,Study To Investigate The Safety And Metabolism Of GSK376501 In Overweight Subjects,COMPLETED,2007-06,2007-12,2007-12,PHASE1,70.0,INTERVENTIONAL,RANDOMIZED,PARALLEL,DIAGNOSTIC,SINGLE,Type 2 Diabetes Mellitus,"DRUG, DRUG","GSK376501, Placebo",GlaxoSmithKline,INDUSTRY,False,0,0,0,0,0
NCT01441232,A Study to Evaluate the Pharmacodynamic Effects of Single-Dose Co-Administration of LX4211 With Januvia® in Type 2 Diabetics,COMPLETED,2011-10,2011-11,2011-11,PHASE1,18.0,INTERVENTIONAL,RANDOMIZED,CROSSOVER,TREATMENT,NONE,Type 2 Diabetes Mellitus,"DRUG, DRUG","LX4211, Januvia®",Lexicon Pharmaceuticals,INDUSTRY,False,0,0,0,0,0
NCT01077505,An Evaluation of the Pharmacokinetics of an Oral Contraceptive (Brevicon) When Co-administered With Albiglutide .,COMPLETED,2010-03-15,2010-11-24,2010-11-24,PHASE1,16.0,INTERVENTIONAL,NON_RANDOMIZED,SINGLE_GROUP,OTHER,NONE,"Diabetes Mellitus, Type 2","BIOLOGICAL, DRUG","albiglutide, Oral contraceptive (Brevicon)",GlaxoSmithKline,INDUSTRY,False,0,0,0,0,0
NCT00306072,Effect of Different Doses of Salacinol Extract on Glycemic and Insulinemic Response in Patients With Type 2 Diabetes,COMPLETED,2005-06,2005-09,2005-09,PHASE1,82.0,INTERVENTIONAL,RANDOMIZED,CROSSOVER,TREATMENT,DOUBLE,Diabetes Mellitus,DRUG,nutritional herbal extract from Salacia oblonga,Ross Products,INDUSTRY,False,0,0,0,0,0
NCT01225939,A Study Conducted Over 3 Periods to Look at the Drug in the Body,COMPLETED,2010-11,2010-12,2010-12,PHASE1,18.0,INTERVENTIONAL,RANDOMIZED,CROSSOVER,TREATMENT,NONE,Type 2 Diabetes Mellitus,"DRUG, DRUG","AZD8329, AZD8329",AstraZeneca,INDUSTRY,False,0,0,0,0,0
NCT00302224,"A Phase 1/2a Study of the 2S,4R Enantiomer of Ketoconazole in Subjects With Type 2 Diabetes Mellitus",COMPLETED,2005-02,2006-08,2006-08,PHASE1,50.0,INTERVENTIONAL,RANDOMIZED,PARALLEL,TREATMENT,DOUBLE,Type 2 Diabetes,DRUG,"2S, 4R Ketoconazole (DIO-902)",DiObex,INDUSTRY,False,0,0,0,0,0
